{
  "identifier": "3134-26-679/SR",
  "source_file": "data/avps/3134-26-679_SR.json",
  "source_sha256": "d0a24c5904f3881aceb03c98222601d0bf9cc7a0a55465cfcc03e7c1106cab3e",
  "esco_version": "v1.2.1",
  "esco_db": "adriens/odata-esco v1.0.1",
  "annotated_at": "2026-10-10",
  "annotation_method": "llm/claude-fable-5 + candidats lexicaux esco.duckdb",
  "occupations": [
    {
      "escoUri": "http://data.europa.eu/esco/occupation/d8ed1703-9c03-4ea0-83cc-b6169bc54ffd",
      "prefLabel_fr": "assistant ressources humaines/assistante ressources humaines",
      "iscoCode": "4416",
      "matchType": "exact",
      "confidence": 0.9,
      "evidence": "Assistant(e) Ressources Humaines études et projets : appui opérationnel aux études et projets RH, données RH, suivi RH"
    },
    {
      "escoUri": "http://data.europa.eu/esco/occupation/bea99fea-0383-4c63-b944-70d4799de2c5",
      "prefLabel_fr": "gestionnaire de projet",
      "iscoCode": "1219",
      "matchType": "broad",
      "confidence": 0.65,
      "evidence": "Contribuer à la préparation, l’instruction et le suivi des travaux d’études RH et à la mise en œuvre des dispositifs RH"
    }
  ],
  "skills": [
    {
      "escoUri": "http://data.europa.eu/esco/skill/279a4b1d-21df-4d78-9f4d-324c73fd7536",
      "prefLabel_fr": "gérer les ressources humaines",
      "skillType": "skill/competence",
      "matchType": "exact",
      "confidence": 0.9,
      "evidence": "Ressources humaines ; contribuer aux études RH, données RH et dispositifs RH",
      "source_field": "educationRequirements.competencyRequired"
    },
    {
      "escoUri": "http://data.europa.eu/esco/skill/7ff2c668-0e86-418a-a962-4958262ee337",
      "prefLabel_fr": "utiliser des techniques de communication",
      "skillType": "skill/competence",
      "matchType": "exact",
      "confidence": 0.9,
      "evidence": "Techniques de communication",
      "source_field": "educationRequirements.competencyRequired"
    },
    {
      "escoUri": "http://data.europa.eu/esco/skill/91dd8397-063d-499c-83b9-0603a10d94ac",
      "prefLabel_fr": "techniques d'écriture",
      "skillType": "knowledge",
      "matchType": "exact",
      "confidence": 0.9,
      "evidence": "Techniques de rédaction",
      "source_field": "educationRequirements.competencyRequired"
    },
    {
      "escoUri": "http://data.europa.eu/esco/skill/cf310cff-0d28-4dbc-9dbb-cc500a3196c2",
      "prefLabel_fr": "logiciels de bureautique",
      "skillType": "knowledge",
      "matchType": "exact",
      "confidence": 0.9,
      "evidence": "Bureautique et outils collaboratifs",
      "source_field": "educationRequirements.competencyRequired"
    },
    {
      "escoUri": "http://data.europa.eu/esco/skill/e437eba1-3e22-41f2-8703-741e94785cba",
      "prefLabel_fr": "gestion des ressources humaines",
      "skillType": "knowledge",
      "matchType": "exact",
      "confidence": 0.85,
      "evidence": "Ressources humaines (statuts du personnel de la fonction publique)",
      "source_field": "educationRequirements.competencyRequired"
    },
    {
      "escoUri": "http://data.europa.eu/esco/skill/b22e46d7-1c5f-4837-943f-7f75531acc26",
      "prefLabel_fr": "déterminer les ressources humaines nécessaires",
      "skillType": "skill/competence",
      "matchType": "close",
      "confidence": 0.85,
      "evidence": "Contribuer à l’identification des besoins en compétences",
      "source_field": "responsibilities"
    },
    {
      "escoUri": "http://data.europa.eu/esco/skill/49de9958-2aa4-4eef-a89d-fe5d5bcd28c4",
      "prefLabel_fr": "s'adapter au changement",
      "skillType": "skill/competence",
      "matchType": "exact",
      "confidence": 0.85,
      "evidence": "Accompagner un changement, une réforme, un dispositif ; Faculté d’adaptation",
      "source_field": "skills"
    },
    {
      "escoUri": "http://data.europa.eu/esco/skill/4e0076f7-155d-4e2a-a058-39097de48420",
      "prefLabel_fr": "transposer la stratégie en actions et objectifs",
      "skillType": "skill/competence",
      "matchType": "exact",
      "confidence": 0.85,
      "evidence": "Traduire un projet en plan d’actions",
      "source_field": "skills"
    },
    {
      "escoUri": "http://data.europa.eu/esco/skill/6c06c0f6-3510-4ef3-ab51-b0bec7f209ba",
      "prefLabel_fr": "rédiger des synthèses",
      "skillType": "skill/competence",
      "matchType": "exact",
      "confidence": 0.85,
      "evidence": "Préparer des éléments d’analyse et de synthèse",
      "source_field": "responsibilities"
    },
    {
      "escoUri": "http://data.europa.eu/esco/skill/93e65de1-923c-437e-aa5b-e6002967ce71",
      "prefLabel_fr": "plateformes collaboratives en ligne",
      "skillType": "knowledge",
      "matchType": "exact",
      "confidence": 0.85,
      "evidence": "Bureautique et outils collaboratifs",
      "source_field": "educationRequirements.competencyRequired"
    },
    {
      "escoUri": "http://data.europa.eu/esco/skill/ece25f2f-e91a-4186-a221-caa715195fd7",
      "prefLabel_fr": "faire preuve de diplomatie",
      "skillType": "skill/competence",
      "matchType": "exact",
      "confidence": 0.85,
      "evidence": "Etre diplomate",
      "source_field": "skills"
    },
    {
      "escoUri": "http://data.europa.eu/esco/skill/88f2ee42-01c8-4390-a108-e733cecaaa77",
      "prefLabel_fr": "agir avec discrétion",
      "skillType": "skill/competence",
      "matchType": "close",
      "confidence": 0.8,
      "evidence": "Faire preuve de discrétion",
      "source_field": "skills"
    },
    {
      "escoUri": "http://data.europa.eu/esco/skill/25e16679-a7d0-464d-916c-63210001bbab",
      "prefLabel_fr": "agir de manière fiable",
      "skillType": "skill/competence",
      "matchType": "close",
      "confidence": 0.8,
      "evidence": "Être rigoureux",
      "source_field": "skills"
    },
    {
      "escoUri": "http://data.europa.eu/esco/skill/ab89ad86-1098-44bb-9465-05af5624557c",
      "prefLabel_fr": "accompagner des personnes",
      "skillType": "skill/competence",
      "matchType": "close",
      "confidence": 0.75,
      "evidence": "Accompagner une personne, un groupe",
      "source_field": "skills"
    },
    {
      "escoUri": "http://data.europa.eu/esco/skill/8744f28f-59a9-45af-8ef6-6944cb5a1473",
      "prefLabel_fr": "recensement des risques",
      "skillType": "knowledge",
      "matchType": "close",
      "confidence": 0.75,
      "evidence": "Alerter sur une situation à risque",
      "source_field": "skills"
    },
    {
      "escoUri": "http://data.europa.eu/esco/skill/dfff95c6-9758-4c04-a228-7eaa88dec6cd",
      "prefLabel_fr": "concevoir la complexité de l’organisation",
      "skillType": "skill/competence",
      "matchType": "close",
      "confidence": 0.75,
      "evidence": "Analyser un contexte, une problématique, une complexité",
      "source_field": "skills"
    },
    {
      "escoUri": "http://data.europa.eu/esco/skill/7111b95d-0ce3-441a-9d92-4c75d05c4388",
      "prefLabel_fr": "gestion de projets",
      "skillType": "knowledge",
      "matchType": "broad",
      "confidence": 0.75,
      "evidence": "Concevoir un projet, une démarche ; élaborer un plan d’action",
      "source_field": "skills"
    },
    {
      "escoUri": "http://data.europa.eu/esco/skill/2db2d9a8-298d-4d1a-a194-d3282e70d6cb",
      "prefLabel_fr": "évaluer les plans d'un projet",
      "skillType": "skill/competence",
      "matchType": "close",
      "confidence": 0.75,
      "evidence": "Préparation, instruction et suivi des travaux d’études RH",
      "source_field": "responsibilities"
    },
    {
      "escoUri": "http://data.europa.eu/esco/skill/98a1dec3-8138-4f46-a596-5e2a83b884b9",
      "prefLabel_fr": "analyse des entreprises",
      "skillType": "knowledge",
      "matchType": "broad",
      "confidence": 0.7,
      "evidence": "Sens de l’analyse ; réaliser des analyses de charge et d’impacts RH",
      "source_field": "skills"
    }
  ]
}
