{
  "identifier": "3134-26-1401/SR",
  "source_file": "data/avps/3134-26-1401_SR.json",
  "source_sha256": "9f6f029efbee4058c2184d06640885d0a47194218c4dee176a3784757b60dc97",
  "esco_version": "v1.2.1",
  "esco_db": "adriens/odata-esco v1.0.1",
  "annotated_at": "2026-10-10",
  "annotation_method": "llm/claude-fable-5 + candidats lexicaux esco.duckdb",
  "occupations": [
    {
      "escoUri": "http://data.europa.eu/esco/occupation/044d78cc-f62f-4532-83a5-8e04f2889652",
      "prefLabel_fr": "assistant administratif/assistante administrative",
      "iscoCode": "3343",
      "matchType": "exact",
      "confidence": 0.9,
      "evidence": "Assistant administratif et opérationnel : assistance administrative, organisationnelle et logistique du NOC, suivi RH, achats et moyens généraux"
    },
    {
      "escoUri": "http://data.europa.eu/esco/occupation/5ac377d2-e1d0-4911-a299-b4ef2782a0ba",
      "prefLabel_fr": "secrétaire",
      "iscoCode": "4120",
      "matchType": "close",
      "confidence": 0.7,
      "evidence": "Accueil physique et téléphonique, gestion du courrier, comptes rendus, organisation des réunions et archivage de documents"
    }
  ],
  "skills": [
    {
      "escoUri": "http://data.europa.eu/esco/skill/88f2ee42-01c8-4390-a108-e733cecaaa77",
      "prefLabel_fr": "agir avec discrétion",
      "skillType": "skill/competence",
      "matchType": "exact",
      "confidence": 0.95,
      "evidence": "Discrétion",
      "source_field": "skills"
    },
    {
      "escoUri": "http://data.europa.eu/esco/skill/5fa6cd2f-9bab-4afa-a184-2d2f1401b770",
      "prefLabel_fr": "rédiger des comptes rendus de réunion",
      "skillType": "skill/competence",
      "matchType": "exact",
      "confidence": 0.9,
      "evidence": "Gérer les comptes rendus et l’organisation des réunions",
      "source_field": "responsibilities"
    },
    {
      "escoUri": "http://data.europa.eu/esco/skill/f715be1d-5fc4-49d3-82a5-0b8090d12849",
      "prefLabel_fr": "synthétiser des informations",
      "skillType": "skill/competence",
      "matchType": "exact",
      "confidence": 0.9,
      "evidence": "Rédiger, synthétiser, mettre en forme des documents et informations",
      "source_field": "skills"
    },
    {
      "escoUri": "http://data.europa.eu/esco/skill/cf310cff-0d28-4dbc-9dbb-cc500a3196c2",
      "prefLabel_fr": "logiciels de bureautique",
      "skillType": "knowledge",
      "matchType": "exact",
      "confidence": 0.9,
      "evidence": "Maîtrise des outils bureautiques",
      "source_field": "educationRequirements.competencyRequired"
    },
    {
      "escoUri": "http://data.europa.eu/esco/skill/8d202e22-85e9-47b1-a1e0-3296d17244cd",
      "prefLabel_fr": "respecter la confidentialité",
      "skillType": "skill/competence",
      "matchType": "exact",
      "confidence": 0.9,
      "evidence": "Sens de la confidentialité",
      "source_field": "skills"
    },
    {
      "escoUri": "http://data.europa.eu/esco/skill/bf9879fa-f1fc-4f17-8dcb-ece29ea61682",
      "prefLabel_fr": "rendre compte de l’activité professionnelle",
      "skillType": "skill/competence",
      "matchType": "exact",
      "confidence": 0.85,
      "evidence": "Identifier une anomalie, alerter et rendre compte à la hiérarchie",
      "source_field": "skills"
    },
    {
      "escoUri": "http://data.europa.eu/esco/skill/7ff2c668-0e86-418a-a962-4958262ee337",
      "prefLabel_fr": "utiliser des techniques de communication",
      "skillType": "skill/competence",
      "matchType": "exact",
      "confidence": 0.85,
      "evidence": "Techniques de communication écrite et orale",
      "source_field": "educationRequirements.competencyRequired"
    },
    {
      "escoUri": "http://data.europa.eu/esco/skill/25e16679-a7d0-464d-916c-63210001bbab",
      "prefLabel_fr": "agir de manière fiable",
      "skillType": "skill/competence",
      "matchType": "exact",
      "confidence": 0.85,
      "evidence": "Fiabilité",
      "source_field": "skills"
    },
    {
      "escoUri": "http://data.europa.eu/esco/skill/e49f4158-9d4c-425d-bf32-dfe89b19840a",
      "prefLabel_fr": "planifier",
      "skillType": "skill/competence",
      "matchType": "close",
      "confidence": 0.8,
      "evidence": "Organiser, prioriser et suivre plusieurs dossiers en parallèle",
      "source_field": "skills"
    },
    {
      "escoUri": "http://data.europa.eu/esco/skill/e2e15494-65b9-4af5-8b86-53fb51e7e022",
      "prefLabel_fr": "gérer des comptes",
      "skillType": "skill/competence",
      "matchType": "close",
      "confidence": 0.8,
      "evidence": "Création et gestion des comptes utilisateurs",
      "source_field": "responsibilities"
    },
    {
      "escoUri": "http://data.europa.eu/esco/skill/70165e8b-322c-489c-b436-66af6190afa3",
      "prefLabel_fr": "gérer une habilitation de sécurité",
      "skillType": "skill/competence",
      "matchType": "close",
      "confidence": 0.8,
      "evidence": "Gérer les droits d’accès aux sites et locaux : badges, habilitations",
      "source_field": "responsibilities"
    },
    {
      "escoUri": "http://data.europa.eu/esco/skill/b19e0820-a96f-4c0a-a724-3c056180c1b3",
      "prefLabel_fr": "construire un esprit d’équipe",
      "skillType": "skill/competence",
      "matchType": "close",
      "confidence": 0.8,
      "evidence": "Esprit d’équipe",
      "source_field": "skills"
    },
    {
      "escoUri": "http://data.europa.eu/esco/skill/49de9958-2aa4-4eef-a89d-fe5d5bcd28c4",
      "prefLabel_fr": "s'adapter au changement",
      "skillType": "skill/competence",
      "matchType": "close",
      "confidence": 0.8,
      "evidence": "Capacité d’adaptation",
      "source_field": "skills"
    },
    {
      "escoUri": "http://data.europa.eu/esco/skill/130d8246-5d34-4cbf-93c6-c02990a26532",
      "prefLabel_fr": "rédiger des documents sans faire de faute",
      "skillType": "skill/competence",
      "matchType": "close",
      "confidence": 0.75,
      "evidence": "Rédiger, mettre en forme des documents et informations",
      "source_field": "skills"
    },
    {
      "escoUri": "http://data.europa.eu/esco/skill/015b0162-6dd3-4d46-bbfd-325086155dd5",
      "prefLabel_fr": "acheter des fournitures",
      "skillType": "skill/competence",
      "matchType": "close",
      "confidence": 0.75,
      "evidence": "Gestion logistique du centre : fournitures, équipements, moyens généraux",
      "source_field": "responsibilities"
    },
    {
      "escoUri": "http://data.europa.eu/esco/skill/31c7add0-0150-4029-bf33-47872c23fcf1",
      "prefLabel_fr": "tenir à jour un inventaire de fournitures de bureau",
      "skillType": "skill/competence",
      "matchType": "close",
      "confidence": 0.75,
      "evidence": "Gestion logistique du centre : fournitures, équipements",
      "source_field": "responsibilities"
    },
    {
      "escoUri": "http://data.europa.eu/esco/skill/64ff8d5f-58a8-4efb-af5a-e161854b3e9a",
      "prefLabel_fr": "comprendre l'anglais parlé",
      "skillType": "skill/competence",
      "matchType": "close",
      "confidence": 0.75,
      "evidence": "Anglais lu et parlé",
      "source_field": "educationRequirements.competencyRequired"
    },
    {
      "escoUri": "http://data.europa.eu/esco/skill/62d07a37-9c9b-40e8-b4e2-5020c7578e24",
      "prefLabel_fr": "gérer des programmes d'accès",
      "skillType": "skill/competence",
      "matchType": "broad",
      "confidence": 0.65,
      "evidence": "Gérer des droits d’accès, comptes utilisateurs et habilitations",
      "source_field": "skills"
    }
  ]
}
