{
  "identifier": "3134-26-1397/SR",
  "source_file": "data/avps/3134-26-1397_SR.json",
  "source_sha256": "e6a4b486165f3b96dd0f5509a612198b466deefe0e317a61ac59e46a83286834",
  "esco_version": "v1.2.1",
  "esco_db": "adriens/odata-esco v1.0.1",
  "annotated_at": "2026-10-10",
  "annotation_method": "llm/claude-fable-5 + candidats lexicaux esco.duckdb",
  "occupations": [
    {
      "escoUri": "http://data.europa.eu/esco/occupation/754ce08f-b4d9-4b9c-b9d2-06f15258a3ce",
      "prefLabel_fr": "directeur d'agence bancaire/directrice d'agence bancaire",
      "iscoCode": "1346",
      "matchType": "close",
      "confidence": 0.8,
      "evidence": "Chef de cellule polyvalent : suppléer le chef d'agence, agent comptable secondaire, gérer fonds, valeurs et services bancaires"
    },
    {
      "escoUri": "http://data.europa.eu/esco/occupation/6a6e174e-cffa-49a9-9f2f-aa39c81cdee5",
      "prefLabel_fr": "guichetier en bureau de poste/guichetière en bureau de poste",
      "iscoCode": "4211",
      "matchType": "broad",
      "confidence": 0.7,
      "evidence": "Tenir la fonction d'agent de guichet ; connaître les offres et produits commercialisés par l'OPT"
    }
  ],
  "skills": [
    {
      "escoUri": "http://data.europa.eu/esco/skill/3982571a-e9ce-442a-a4a0-fdfc97727091",
      "prefLabel_fr": "tenir une caisse",
      "skillType": "skill/competence",
      "matchType": "exact",
      "confidence": 0.94,
      "evidence": "Manipuler du numéraire et tenir une caisse",
      "source_field": "educationRequirements.competencyRequired"
    },
    {
      "escoUri": "http://data.europa.eu/esco/skill/cf310cff-0d28-4dbc-9dbb-cc500a3196c2",
      "prefLabel_fr": "logiciels de bureautique",
      "skillType": "knowledge",
      "matchType": "exact",
      "confidence": 0.92,
      "evidence": "Maîtriser les outils de bureautique, les applications informatiques et les logiciels de guichet",
      "source_field": "educationRequirements.competencyRequired"
    },
    {
      "escoUri": "http://data.europa.eu/esco/skill/cb668e89-6ef5-4ff3-ab4a-506010e7e70b",
      "prefLabel_fr": "gérer une équipe",
      "skillType": "skill/competence",
      "matchType": "exact",
      "confidence": 0.9,
      "evidence": "Manager ; développer les niveaux de maîtrise des différentes fonctions au sein de sa section",
      "source_field": "skills"
    },
    {
      "escoUri": "http://data.europa.eu/esco/skill/dc9a236c-c640-43c3-812f-269403591edb",
      "prefLabel_fr": "gestion de la relation client",
      "skillType": "knowledge",
      "matchType": "exact",
      "confidence": 0.9,
      "evidence": "Gérer une relation client ; satisfaction des clients",
      "source_field": "skills"
    },
    {
      "escoUri": "http://data.europa.eu/esco/skill/26a6e6d2-1c9a-4d7e-8c04-5ba16d1f53da",
      "prefLabel_fr": "accueillir les clients",
      "skillType": "skill/competence",
      "matchType": "exact",
      "confidence": 0.9,
      "evidence": "Accueillir une personne, un groupe, du public",
      "source_field": "skills"
    },
    {
      "escoUri": "http://data.europa.eu/esco/skill/5a927fa0-462e-4d54-ae12-97fd6ca45762",
      "prefLabel_fr": "pratiquer le self-control",
      "skillType": "skill/competence",
      "matchType": "exact",
      "confidence": 0.9,
      "evidence": "Maîtrise de soi",
      "source_field": "skills"
    },
    {
      "escoUri": "http://data.europa.eu/esco/skill/001115fb-569f-4ee6-8381-c6807ef2527f",
      "prefLabel_fr": "faire preuve d’initiative",
      "skillType": "skill/competence",
      "matchType": "exact",
      "confidence": 0.9,
      "evidence": "Esprit d'initiative",
      "source_field": "skills"
    },
    {
      "escoUri": "http://data.europa.eu/esco/skill/ecc18804-a466-40d9-98b4-fba5cd67dd4b",
      "prefLabel_fr": "comptabilité",
      "skillType": "knowledge",
      "matchType": "exact",
      "confidence": 0.9,
      "evidence": "Maîtriser la comptabilité des agences",
      "source_field": "educationRequirements.competencyRequired"
    },
    {
      "escoUri": "http://data.europa.eu/esco/skill/1f1d2ff8-c4c1-45cc-9812-6a7ee84a73cb",
      "prefLabel_fr": "diriger une équipe",
      "skillType": "skill/competence",
      "matchType": "close",
      "confidence": 0.86,
      "evidence": "Diriger une structure, un service",
      "source_field": "skills"
    },
    {
      "escoUri": "http://data.europa.eu/esco/skill/d5145a9a-602e-40bf-b3e1-f04cf9c3ef86",
      "prefLabel_fr": "principes de leadership",
      "skillType": "knowledge",
      "matchType": "exact",
      "confidence": 0.86,
      "evidence": "Faire preuve de leadership",
      "source_field": "skills"
    },
    {
      "escoUri": "http://data.europa.eu/esco/skill/b19e0820-a96f-4c0a-a724-3c056180c1b3",
      "prefLabel_fr": "construire un esprit d’équipe",
      "skillType": "skill/competence",
      "matchType": "exact",
      "confidence": 0.86,
      "evidence": "Avoir l’esprit d'équipe",
      "source_field": "skills"
    },
    {
      "escoUri": "http://data.europa.eu/esco/skill/281a0cb1-4e12-46f4-ba4a-2746cba36e78",
      "prefLabel_fr": "coordonner des équipes",
      "skillType": "skill/competence",
      "matchType": "close",
      "confidence": 0.84,
      "evidence": "Organiser le travail de la cellule",
      "source_field": "responsibilities"
    },
    {
      "escoUri": "http://data.europa.eu/esco/skill/6d7e3b0c-3995-4953-816d-cf3c5e9ffe34",
      "prefLabel_fr": "respecter les procédures opérationnelles standard",
      "skillType": "skill/competence",
      "matchType": "close",
      "confidence": 0.84,
      "evidence": "Contrôler et piloter la bonne compréhension et application des directives, instructions de travail, guides et procédures",
      "source_field": "responsibilities"
    },
    {
      "escoUri": "http://data.europa.eu/esco/skill/e49f4158-9d4c-425d-bf32-dfe89b19840a",
      "prefLabel_fr": "planifier",
      "skillType": "skill/competence",
      "matchType": "close",
      "confidence": 0.82,
      "evidence": "Prévoir et anticiper ; tirer des prévisions quant à la mobilisation des moyens nécessaires",
      "source_field": "responsibilities"
    },
    {
      "escoUri": "http://data.europa.eu/esco/skill/15d76317-c71a-4fa2-aadc-2ecc34e627b7",
      "prefLabel_fr": "communication",
      "skillType": "knowledge",
      "matchType": "close",
      "confidence": 0.82,
      "evidence": "S’exprimer à l’oral ; expliquer",
      "source_field": "skills"
    },
    {
      "escoUri": "http://data.europa.eu/esco/skill/88f2ee42-01c8-4390-a108-e733cecaaa77",
      "prefLabel_fr": "agir avec discrétion",
      "skillType": "skill/competence",
      "matchType": "close",
      "confidence": 0.82,
      "evidence": "Faire preuve de discrétion",
      "source_field": "skills"
    }
  ]
}
